,Symbol,Name
2261,ONE,"Higher One Holdings, Inc. Common Stock"
2262,OPK,OPKO Health Inc. Common Stock
2263,OPWR,"Opower, Inc. Common Stock"
2264,OPY,"Oppenheimer Holdings, Inc. Class A Common Stock (DE)"
2265,ORA,"Ormat Technologies, Inc. Common Stock"
2266,ORAN,Orange
2267,ORB,Orbital Sciences Corporation Common Stock
2268,ORC,"Orchid Island Capital, Inc. Common Stock"
2269,ORCL,Oracle Corporation Common Stock
2270,ORI,Old Republic International Corporation Common Stock
2271,ORN,Orion Marine Group Inc Common
2272,OSK,Oshkosh Corporation (Holding Company)Common Stock
2273,OUBS,UBS AG Common Stock
2274,OUT,OUTFRONT Media Inc. Common Stock
2275,OWW,"Orbitz Worldwide, Inc. Common Stock"
2276,OXM,"Oxford Industries, Inc. Common Stock"
2277,OXY,Occidental Petroleum Corporation Common Stock
2278,OZM,Och
2279,P,"Pandora Media, Inc. Common Stock"
2280,PAA,"Plains All American Pipeline, L.P. Common Stock"
2281,PAC,"Grupo Aeroportuario Del Pacifico, S.A. B. de C.V. Grupo Aeroportuario Del Pacifico, S.A. de C.V. (each representing 10 Series B shares)"
2282,PACD,Pacific Drilling S.A. Common Shares
2283,PAG,"Penske Automotive Group, Inc. Common Stock"
2284,PAGP,"Plains Group Holdings, L.P. Class A Shares representing limited partner interests"
2285,PAH,Platform Specialty Products Corporation Common Stock
2286,PAI,Western Asset Income Fund Common Stock
2287,PAM,Pampa Energia S.A. Pampa Energia S.A.
2288,PANW,"Palo Alto Networks, Inc. Common Stock"
2289,PAR,PAR Technology Corporation Common Stock
2290,PAY,"Verifone Systems, Inc. Common Stock"
2291,PAYC,"Paycom Software, Inc. Common Stock"
2292,PB,"Prosperity Bancshares, Inc. Common Stock"
2293,PBA,Pembina Pipeline Corp. Ordinary Shares (Canada)
2294,PBF,PBF Energy Inc. Class A Common Stock
2295,PBFX,PBF Logistics LP Common Units representing limited partner interests
2296,PBH,"Prestige Brand Holdings, Inc. Common Stock"
2297,PBI,Pitney Bowes Inc. Common Stock
2298,PBI$A,Pitney Bowes Inc 5.25% Notes due 2022
2299,PBI$B,Pitney Bowes Inc 6.70% Notes Due 2043
2300,PBR,Petroleo Brasileiro S.A.
2301,PBR.A,Petroleo Brasileiro S.A.
2302,PBT,Permian Basin Royalty Trust Common Stock
2303,PBY,Pep Boys
2304,PBYI,Puma Biotechnology Inc Common Stock
2305,PCF,Putnam High Income Securities Fund Common Stock
2306,PCG,Pacific Gas & Electric Co. Common Stock
2307,PCI,PIMCO Dynamic Credit Income Fund Common Shares of Beneficial Interest
2308,PCK,Pimco California Municipal Income Fund II Common Shares of Beneficial Interest
2309,PCL,"Plum Creek Timber Company, Inc. Common Stock"
2310,PCM,"PCM Fund, Inc. Common Stock"
2311,PCN,Pimco Corporate & Income Strategy Fund Common Stock
2312,PCP,Precision Castparts Corporation Common Stock
2313,PCQ,PIMCO California Municipal Income Fund Common Stock
2314,PDI,PIMCO Dynamic Income Fund Common Stock
2315,PDM,"Piedmont Office Realty Trust, Inc. Class A Common Stock"
2316,PDS,Precision Drilling Corporation Common Stock
2317,PDT,John Hancock Premium Dividend Fund
2318,PE,"Parsley Energy, Inc. Class A Common Stock"
2319,PEB,Pebblebrook Hotel Trust Common Shares of Beneficial Interest
2320,PEB$A,Pebblebrook Hotel Trust PFD SER A
2321,PEB$B,Pebblebrook Hotel Trust Preferred Series B
2322,PEB$C,Pebblebrook Hotel Trust 6.50% Series C Cumulative Redeemable Preferred Shares of Beneficial Interest
2323,PEG,Public Service Enterprise Group Incorporated Common Stock
2324,PEI,Pennsylvania Real Estate Investment Trust Common Stock
2325,PEI$A,Pennsylvania Real Estate Investment Trust PFD sh CL A
2326,PEI$B,Pennsylvania Real Estate Investment Trust Cumulative Redeemable Perpetual Preferred Shares Series B
2327,PEO,Petroleum Resources Corporation Common Stock
2328,PEP,"Pepsico, Inc. Common Stock"
2329,PER,SandRidge Permian Trust Common Units of Benficial Interest
2330,PES,Pioneer Energy Services Corp. Common Stk
2331,PF,"Pinnacle Foods, Inc. Common Stock"
2332,PFD,Flaherty & Crumrine Preferred Income Fund Incorporated Common Stock
2333,PFE,"Pfizer, Inc. Common Stock"
2334,PFG,Principal Financial Group Inc Common Stock
2335,PFG$B,"Principal Financial Group, Inc. 6.518% Series B Non"
2336,PFH,Cabco Tr Jcp 7.625 Common Stock
2337,PFK,Prudential Financial Inflation
2338,PFL,PIMCO Income Strategy Fund Shares of Beneficial Interest
2339,PFN,PIMCO Income Strategy Fund II
2340,PFO,Flaherty & Crumrine Preferred Income Opportunity Fund Incorporated Common Stock
2341,PFS,"Provident Financial Services, Inc Common Stock"
2342,PFSI,"PennyMac Financial Services, Inc. Class A Common Stock"
2343,PFX,"Phoenix Companies, Inc. Phoenix Companies Inc 7.45% Pfd"
2344,PG,Procter & Gamble Company (The) Common Stock
2345,PGEM,"Ply Gem Holdings, Inc. Common Stock"
2346,PGH,Pengrowth Energy Corporation
2347,PGI,"Premiere Global Services, Inc."
2348,PGN,Paragon Offshore plc Ordinary Shares
2349,PGP,Pimco Global Stocksplus & Income Fund Pimco Global StocksPlus & Income Fund Common Shares of Beneficial Interest
2350,PGR,Progressive Corporation (The) Common Stock
2351,PGRE,"Paramount Group, Inc. Common Stock"
2352,PGZ,Principal Real Estate Income Fund Common Shares of Beneficial Interest
2353,PH,Parker
2354,PHD,Pioneer Floating Rate Trust Pioneer Floating Rate Trust Shares of Beneficial Interest
2355,PHG,Koninklijke Philips N.V. NY Registry Shares
2356,PHH,PHH Corp Common Stock
2357,PHI,Philippine Long Distance Telephone Company Sponsored ADR
2358,PHK,Pimco High Income Fund Pimco High Income Fund
2359,PHM,"PulteGroup, Inc. Common Stock"
2360,PHT,Pioneer High Income Trust Common Shares of Beneficial Interest
2361,PHX,Panhandle Oil and Gas Inc Common Stock
2362,PII,Polaris Industries Inc. Common Stock
2363,PIM,Putnam Master Intermediate Income Trust Common Stock
2364,PIR,"Pier 1 Imports, Inc. Common Stock"
2365,PIY,Preferred Plus Trust (Ser CZN) Preferred Plus Trust Ser CZN
2366,PJC,Piper Jaffray Companies Common Stock
2367,PJH,"Prudential Financial, Inc. 5.75% Junior Subordinated Notes due 2052"
2368,PJS,PreferredPlus Trust Ser FAR 1 Tr Ctf
2369,PKD,Parker Drilling Company Common Stock
2370,PKE,Park Electrochemical Corporation Common Stock
2371,PKG,Packaging Corporation of America Common Stock
2372,PKI,"PerkinElmer, Inc. Common Stock"
2373,PKO,Pimco Income Opportunity Fund Common Shares of Beneficial Interest
2374,PKX,POSCO Common Stock
2375,PKY,"Parkway Properties, Inc. Common Stock"
2376,PL,Protective Life Corporation Common Stock
2377,PL$B,Protective Life Corporation PLC Capital Trust V Trust Originated Preferred Securities (TOPRS)
2378,PL$C,Protective Life Corporation 6.25% Subordinated Debentures due 2042
2379,PL$E,Protective Life Corporation 6.00% Subordinated Debentures due 2042
2380,PLD,"ProLogis, Inc. Common Stock"
2381,PLL,Pall Corporation Common Stock
2382,PLOW,"Douglas Dynamics, Inc. Common Stock"
2383,PLT,"Plantronics, Inc. Common Stock"
2384,PM,Philip Morris International Inc Common Stock
2385,PMC,Pharmerica Corporation Common Stock
2386,PMF,PIMCO Municipal Income Fund Common Stock
2387,PML,Pimco Municipal Income Fund II Common Shares of Beneficial Interest
2388,PMM,Putnam Managed Municipal Income Trust Common Stock
2389,PMO,Putnam Municipal Opportunities Trust Common Stock
2390,PMT,PennyMac Mortgage Investment Trust Common Shares of Beneficial Interest
2391,PMX,PIMCO Municipal Income Fund III Common Shares of Beneficial Interest
2392,PNC,"PNC Financial Services Group, Inc. (The) Common Stock"
2393,PNC$P,"PNC Financial Services Group, Inc. (The) Depositary Shares Representing 1/4000th Perpetual Preferred Series P"
2394,PNC$Q,"PNC Financial Services Group, Inc. (The) Depositary Shares Representing 1/4000th Perpetual Preferred Shares Series Q"
2395,PNC.W,"PNC Financial Services Group, Inc. Warrant expiring December 31, 2018"
2396,PNF,PIMCO New York Municipal Income Fund Common Stock
2397,PNI,Pimco New York Municipal Income Fund II Common Shares of Beneficial Interest
2398,PNK,"Pinnacle Entertainment, Inc. Common Stock"
2399,PNM,"PNM Resources, Inc. (Holding Co.) Common Stock"
2400,PNR,Pentair plc. Ordinary Share
2401,PNTA,PennantPark Investment Corporation 6.25% Senior Notes due 2025
2402,PNW,Pinnacle West Capital Corporation Common Stock
2403,PNX,"Phoenix Companies, Inc. (The) Common Stock"
2404,PNY,"Piedmont Natural Gas Company, Inc. Common Stock"
2405,POL,PolyOne Corporation Common Stock
2406,POM,"PEPCO Holdings, Inc Common Stock"
2407,POR,Portland General Electric Co Common Stock
2408,POST,"Post Holdings, Inc. Common Stock"
2409,POT,Potash Corporation of Saskatchewan Inc. Common Stock
2410,POWR,"PowerSecure International, Inc. Common Stock"
2411,PPG,"PPG Industries, Inc. Common Stock"
2412,PPL,PP&L Corporation Common Stock
2413,PPO,Polypore International Inc Common Stock
2414,PPP,Primero Mining Corp.  New Common Shares (Canada)
2415,PPR,Voya Prime Rate Trust Shares of Beneficial Interest
2416,PPS,"Post Properties, Inc. Common Stock"
2417,PPS$A,"Post Properties, Inc. Preferred Stock"
2418,PPT,Putnam Premier Income Trust Common Stock
2419,PPX,"PPL Capital Funding, Inc. 2013 Series B Junior Subordinated Notes due 2073"
2420,PQ,Petroquest Energy Inc Common Stock
2421,PRA,ProAssurance Corporation Common Stock
2422,PRE,PartnerRe Ltd. Common Stock
2423,PRE$D,PartnerRe Ltd. Preferred Series D 6.5% (Bermuda)
2424,PRE$E,PartnerRe Ltd. PFD SER E (Bermuda)
2425,PRE$F,PartnerRe Ltd. Redeemable Preferred Shares Series F (Bermuda)
2426,PRGO,Perrigo Company plc Ordinary Shares
2427,PRH,"Prudential Financial, Inc. 5.70% Junior Subordinated Notes due 2053"
2428,PRI,"Primerica, Inc. Common Stock"
2429,PRLB,"Proto Labs, Inc. Common stock"
2430,PRO,"PROS Holdings, Inc. Common Stock"
2431,PRU,"Prudential Financial, Inc. Common Stock"
2432,PRY,Prospect Capital Corporation 6.95% Senior Notes due 2022
2433,PSA,Public Storage Common Stock
2434,PSA$A,"Public Storage Depositary Shares each representing 1/1,000 of a 5.875% Cumulative Preferred SBI, Series A"
2435,PSA$O,Public Storage Depositary Shares Representing 1/1000% Cumulative Pfd Sh Ben Int Series O
2436,PSA$P,Public Storage DEPOSITARY SHS REPSTG % CUMULATIVE PFD SHS BEN INT (SER P)
2437,PSA$Q,Public Storage DEPOSITARY SHS REPSTG 1/1000TH PFD SHS BEN INT SER Q
2438,PSA$R,Public Storage Depository Sh Repstg 1/1000th Pfd Ser R
2439,PSA$S,Public Storage DEP SH REPSTG PFD SH BEN INT SER S
2440,PSA$T,Public Storage Depository Shares Representing 1/1000 Pfd Shares Beneficial Interest Series T
2441,PSA$U,Public Storage Depositary Shares Representing 1/1000 Preferred Benerficial Interest Series U
2442,PSA$V,Public Storage Dep Shs Repstg 1/1000th Pfd Sh Ben Int Ser V
2443,PSA$W,Public Storage Depositary Shares Representing 1/1000 Preferred Shares of Benficial Interest Series W
2444,PSA$X,Public Storage Depositary Shares Representing 1/1000th Cumulative Preferred Shares Beneficial Interest Series X
2445,PSA$Y,Public Storage Dep Shs Repstg 1/1000th Pfd Sh Ben Int Ser Y
2446,PSA$Z,Public Storage Dep Shs Representing 1/1000th Pfd Sh Ben Int Ser Z
2447,PSB,"PS Business Parks, Inc. Common Stock"
2448,PSB$R,"PS Business Parks, Inc. Depositary Shares, Each representing 1/1,000 of a share of 6.875% Cumulative Preferred stock, Series R, $0.01 par"
2449,PSB$S,"PS Business Parks, Inc. Depositary Shares, each representing 1/1,000 of a share of 6.45% Cumulative Preferred Stock"
2450,PSB$T,"PS Business Parks, Inc. Depositary Shares Representing 1/1000th Preferred Series T"
2451,PSB$U,"PS Business Parks, Inc. Dep Shs Repstg 1/1000 Pfd Ser U"
2452,PSB$V,"PS Business Parks, Inc. Depositary Shares Represting 1/1000th Shares Cumulative Preferred Stock Series V"
2453,PSF,"Cohen & Steers Select Preferred and Income Fund, Inc. Common Stock"
2454,PSG,Performance Sports Group Ltd. Ordinary Shares (Canada)
2455,PSO,"Pearson, Plc Common Stock"
2456,PSX,Phillips 66 Common Stock
2457,PSXP,Phillips 66 Partners LP Common Units representing limited partner interest in the Partnership
2458,PT,"Portugal Telecom SGPS, S.A . Common Stock"
2459,PTP,"Platinum Underwriters Holdings, Ltd"
2460,PTR,PetroChina Company Limited Common Stock
2461,PTY,Pimco Corporate & Income Opportunity Fund
2462,PUK,Prudential Public Limited Company Common Stock
2463,PUK$,Prudential Public Limited Company 6.75% Perpetual Subordinated Captial Security
2464,PUK$A,Prudential Public Limited Company 6.50% Perpetual Subordinated Capital Securities Exchangeable at the Issuer's Option Into Non
2465,PVA,Penn Virginia Corporation Common Stock
2466,PVG,"Pretium Resources, Inc. Ordinary Shares (Canada)"
2467,PVH,PVH Corp. Common Stock
2468,PVTD,"PrivateBancorp, Inc. 7.125% Subordinated Debentures due 2042"
2469,PWE,Penn West Petroleum Ltd
2470,PWR,"Quanta Services, Inc. Common Stock"
2471,PX,"Praxair, Inc. Common Stock"
2472,PXD,Pioneer Natural Resources Company Common Stock
2473,PYB,PPlus Trust Series GSG
2474,PYN,PIMCO New York Municipal Income Fund III Common Shares of Beneficial Interest
2475,PYS,Merrill Lynch Depositor Inc PPlus Tr Ser RRD
2476,PYT,PPlus Tr GSC
2477,PZB,"Merrill Lynch Depositor, Inc. Merrill Lynch Depositor, Inc. PPLUS Class A 6.7% Callable Trust Certificates, Series LTD"
2478,PZC,PIMCO California Municipal Income Fund III Common Shares of Beneficial Interest
2479,PZE,Petrobras Argentina S.A. ADS
2480,PZN,Pzena Investment Management Inc Class A Common Stock
2481,Q,Quintiles Transnational Holdings Inc. Common Stock
2482,QEP,"QEP Resources, Inc. Common Stock"
2483,QEPM,"QEP Midstream Partners, LP Common Units representing Limited Partner Interests"
2484,QIHU,"Qihoo 360 Technology Co. Ltd. American Depositary Shares, every 2 of which representing three Class A Ordinary Shares"
2485,QSR,Restaurant Brands International Inc. Common Shares
2486,QTM,Quantum Corporation Common Stock
2487,QTS,"QTS Realty Trust, Inc. Class A Common Stock"
2488,QTWO,"Q2 Holdings, Inc. Common Stock"
2489,QUAD,"Quad Graphics, Inc Class A Common Stock"
2490,R,"Ryder System, Inc. Common Stock"
2491,RAD,Rite Aid Corporation Common Stock
2492,RAI,Reynolds American Inc Common Stock
2493,RALY,Rally Software Development Corp. Common Stock
2494,RAS,RAIT Financial Trust New Common Shares of Beneficial Interest
2495,RAS$A,RAIT Financial Trust  7.75% Series A Cumulative Redeemable Preferred Shares of Beneficial Interest
2496,RAS$B,RAIT Financial Trust 8.375% Series B Cumulative Redeemable Preferred Shares of Beneficial Interest
2497,RAS$C,RAIT Financial Trust 8.875% Series C Cumulative Redeemable Preferred Shares of Beneficial Interest
2498,RATE,"Bankrate, Inc. Common Stock"
2499,RAX,"Rackspace Hosting, Inc Common Stock"
2500,RBA,Ritchie Bros. Auctioneers Incorporated Common Stock
2501,RBC,Regal Beloit Corporation Common Stock
2502,RBS,Royal Bank of Scotland Group Plc New (The) ADS
2503,RBS$E,RBS Capital Funding Trust V
2504,RBS$F,Royal Bank of Scotland Group Plc (The) Preferred Stock
2505,RBS$G,RBS Capital Funding Trust VII
2506,RBS$H,Royal Bank of Scotland Group Plc (The) Preferred Stock
2507,RBS$I,RBS Capital Funding Trust VI
2508,RBS$L,Royal Bank of Scotland Group Plc (The) ADR representing One Non
2509,RBS$M,Royal Bank of Scotland Group Plc (The) ADS Series M
2510,RBS$N,Royal Bank of Scotland Group Plc (The) Royal Bank of Scotland Group PLC (The) American Depositary Shares (each representing One Non
2511,RBS$P,Royal Bank of Scotland Group Plc (The) ADR representing Preferred Shares Series P
2512,RBS$Q,Royal Bank of Scotland Group Plc (The) ADR repstg Pref Shs Ser Q
2513,RBS$R,Royal Bank of Scotland Group Plc (The) ADR repstg USD Pfd Shs Ser R (United Kingdom)
2514,RBS$S,Royal Bank of Scotland Group Plc (The) Sponsored ADR Repstg Pref Ser S (United Kingdom)
2515,RBS$T,Royal Bank of Scotland Group Plc (The) Sponsored ADR Representing Pfef shs ser T (United Kingdom)
2516,RCAP,RCS CAPITAL CORPORATION Common Stock
2517,RCI,"Rogers Communication, Inc. Common Stock"
2518,RCL,Royal Caribbean Cruises Ltd. Common Stock
2519,RCS,"PIMCO Strategic Income Fund, Inc."
2520,RDC,Rowan Companies plc Class A Ordinary Shares
2521,RDN,Radian Group Inc. Common Stock
2522,RDS.A,Royal Dutch Shell PLC Royal Dutch Shell American Depositary Shares (Each representing two Class A Ordinary Shares)
2523,RDS.B,Royal Dutch Shell PLC Royal Dutch Shell PLC American Depositary Shares (Each representing two Class B Ordinary Shares)
2524,RDY,Dr. Reddy's Laboratories Ltd Common Stock
2525,RE,"Everest Re Group, Ltd. Common Stock"
2526,REG,Regency Centers Corporation Common Stock
2527,REG$F,Regency Centers Corporation Cumulative Red Preferred Series 6%
2528,REG$G,Regency Centers Corporation Pfd Ser 7%
2529,REN,Resolute Energy Corporation Comon Stock
2530,RENN,"Renren Inc. American Depositary Shares, each representing three Class A ordinary shares"
2531,RES,"RPC, Inc. Common Stock"
2532,RESI,Altisource Residential Corporation Common Stock
2533,REV,"Revlon, Inc. New Common Stock"
2534,REX,REX American Resources Corporation
2535,REXR,"Rexford Industrial Realty, Inc. Common Stock"
2536,RF,Regions Financial Corporation Common Stock
2537,RF$A,Regions Financial Corporation Depositary Shares Representing 1/40th Perpetual Preferred Series A
2538,RF$B,Regions Financial Corporation Depositary Shares Representing 1/40th Perpetual Preferred Series B
2539,RFI,"Cohen & Steers Total Return Realty Fund, Inc. Common Stock"
2540,RFP,Resolute Forest Products Inc. Common Stock
2541,RFT,RAIT Financial Trust 7.625% Senior Notes due 2024
2542,RFTA,RAIT Financial Trust 7.125% Senior Notes due 2019
2543,RGA,"Reinsurance Group of America, Incorporated Common Stock"
2544,RGC,Regal Entertainment Group Class A Common Stock
2545,RGP,Regency Energy Partners LP Common Units Representing Limited Partner Interests
2546,RGR,"Sturm, Ruger & Company, Inc. Common Stock"
2547,RGS,Regis Corporation Common Stock
2548,RGT,"Royce Global Value Trust, Inc. Common Stock"
2549,RH,Restoration Hardware Holdings Inc. Common Stock
2550,RHI,Robert Half International Inc. Common Stock
2551,RHP,"Ryman Hospitality Properties, Inc. (REIT)"
2552,RHT,"Red Hat, Inc. Common Stock"
2553,RICE,Rice Energy Inc. Common Stock
2554,RIG,Transocean Ltd (Switzerland) Common Stock
2555,RIGP,Transocean Partners LLC Common Units Representing Limited Liability Company Interests
2556,RIO,Rio Tinto Plc Common Stock
2557,RIOM,Rio Alto Mining Limited Common Shares (Canada)
2558,RIT,LMP Real Estate Income Fund Inc Common Stock
2559,RJD,"Raymond James Financial, Inc. 6.90% Senior Notes Due 2042"
2560,RJF,"Raymond James Financial, Inc. Common Stock"
2561,RKT,Rock
2562,RKUS,"Ruckus Wireless, Inc. Common Stock"
2563,RL,Ralph Lauren Corporation Common Stock
2564,RLD,RealD Inc Common Stock
2565,RLGY,Realogy Holdings Corp. Common Stock
2566,RLH,Red Lions Hotels Corporation Common Stock
2567,RLH$A,Red Lion Hotels Capital Trust Red Lion Hotels Capital Trust
2568,RLI,RLI Corp. Common Stock
2569,RLJ,RLJ Lodging Trust Common Shares of Beneficial Interest $0.01 par value
2570,RM,Regional Management Corp. Common Stock
2571,RMAX,"RE/MAX Holdings, Inc. Class A Common Stock"
2572,RMD,ResMed Inc. Common Stock
2573,RMP,Rice Midstream Partners LP Common Units representing limited partner interests
2574,RMT,Royce Micro
2575,RNDY,"Roundy's, Inc. Common Stock"
2576,RNE,"Morgan Stanley Eastern Europe Fund, Inc. Common Stock"
2577,RNF,"Rentech Nitrogen Partners, L.P. Common Units representing limited partner interests"
2578,RNG,"Ringcentral, Inc. Class A Common Stock"
2579,RNO,Rhino Resource Partners LP Common Units representing limited partnership interests
2580,RNP,Cohen & Steers Reit and Preferred Income Fund Inc Common Shares
2581,RNR,RenaissanceRe Holdings Ltd. Common Stock
2582,RNR$C,RenaissanceRe Holdings Ltd. 6.08% Series C Preference Shares
2583,RNR$E,RenaissanceRe Holdings Ltd. 5.375% Series E Preference Shares
2584,ROC,"Rockwood Holdings, Inc. Common Stock"
2585,ROG,Rogers Corporation Common Stock
2586,ROK,"Rockwell Automation, Inc. Common Stock"
2587,ROL,"Rollins, Inc. Common Stock"
2588,ROP,"Roper Industries, Inc. Common Stock"
2589,ROYT,Pacific Coast Oil Trust Units of Beneficial Interest
2590,RPAI,"Retail Properties of America, Inc. Class A Common Stock"
2591,RPAI$A,"Retail Properties of America, Inc. Pfd Ser A %"
2592,RPM,RPM International Inc. Common Stock
2593,RPT,Ramco
2594,RPT$D,Ramco
2595,RQI,Cohen & Steers Quality Income Realty Fund Inc Common Shares
2596,RRC,Range Resources Corporation Common Stock
2597,RRMS,"Rose Rock Midstream, L.P. Common Units Representing Limited Partner Interests"
2598,RRTS,"Roadrunner Transportation Systems, Inc Common Stock"
2599,RS,Reliance Steel & Aluminum Co. Common Stock
2600,RSE,"Rouse Properties, Inc. Common Stock"
2601,RSG,"Republic Services, Inc. Common Stock"
2602,RSH,Radioshack Corporation Common Stock
2603,RSO,Resource Capital Corp. Resource Capital Corp. Common Stock
2604,RSO$A,Resource Capital Corp. 8.50% Series A Cumulative Redeemable Preferred Stock
2605,RSO$B,Resource Capital Corp. Pfd Ser B
2606,RSO$C,Resource Capital Corp. Preferred Series C
2607,RSPP,"RSP Permian, Inc. Common Stock"
2608,RST,"Rosetta Stone Rosetta Stone, Inc."
2609,RT,"Ruby Tuesday, Inc. Common Stock"
2610,RTEC,"Rudolph Technologies, Inc. Common Stock"
2611,RTI,"RTI International Metals, Inc. Common Stock"
2612,RTN,Raytheon Company Common Stock
2613,RUBI,"The Rubicon Project, Inc. Common Stock"
2614,RUK,Reed Elsevier NV PLC New ADS
2615,RVT,"Royce Value Trust, Inc. Common Stock"
2616,RWT,"Redwood Trust, Inc. Common Stock"
2617,RXN,Rexnord Corporation Common Stock
2618,RY,Royal Bank Of Canada Common Stock
2619,RYAM,Rayonier Advanced Materials Inc. Common Stock
2620,RYI,Ryerson Holding Corporation Common Stock
2621,RYL,"Ryland Group, Inc. (The) Common Stock"
2622,RYN,Rayonier Inc. REIT Common Stock
2623,RZA,"Reinsurance Group of America, Incorporated 6.20% Fixed"
2624,S,Sprint Corporation Common Stock
2625,SA,"Seabridge Gold, Inc. Ordinary Shares (Canada)"
2626,SAH,"Sonic Automotive, Inc. Common Stock"
2627,SAIC,SCIENCE APPLICATIONS INTERNATIONAL CORPORATION Common Stock
2628,SALT,Scorpio Bulkers Inc. Common Stock
2629,SAM,"Boston Beer Company, Inc. (The) Common Stock"
2630,SAN,"Banco Santander, S.A. Sponsored ADR (Spain)"
2631,SAN$A,"Banco Santander, S.A. 6.80% Non"
2632,SAN$B,Santander Finance Preferred SA Unipersonal Floating Rate Non
2633,SAN$C,"Banco Santander, S.A. 6.50% Non"
2634,SAN$I,"Banco Santander Central Hispano, S.A. Santander Finance Preferred S.A. Unipersonal 6.41% Non"
2635,SAP,SAP  SE ADS
2636,SAQ,Saratoga Investment Corp 7.50% Notes due 2020
2637,SAR,Saratoga Investment Corp New
2638,SB,"Safe Bulkers, Inc Common Stock ($0.001 par value)"
2639,SB$B,"Safe Bulkers, Inc 8.00% Series B Cumulative Redeemable Perpetual Preferred Shares"
2640,SB$C,"Safe Bulkers, Inc Cumulative Redeemable Perpetual Preferred Series C (Marshall Islands)"
2641,SB$D,"Safe Bulkers, Inc Perpetual Preferred Series D (Marshall Islands)"
2642,SBGL,Sibanye Gold Limited American Depositary Shares (Each representing four ordinary shares)
2643,SBH,"Sally Beauty Holdings, Inc. (Name to be changed from Sally Holdings, Inc.) Common Stock"
2644,SBNA,Scorpio Tankers Inc. 6.75% Senior Notes due 2020
2645,SBNB,Scorpio Tankers Inc. 7.50% Senior Notes Due 2017
2646,SBR,Sabine Royalty Trust Common Stock
2647,SBS,Companhia de saneamento Basico Do Estado De Sao Paulo
2648,SBW,Western Asset Worldwide Income Fund Inc. Common Stock
2649,SBY,Silver Bay Realty Trust Corp. Common Stock
2650,SC,Santander Consumer USA Holdings Inc. Common Stock
2651,SCCO,Southern Copper Corporation Common Stock
2652,SCD,LMP Capital and Income Fund Inc. Common Stock
2653,SCE$F,Southern California Edison Trust I Trust Preferred Securities
2654,SCE$G,SCE Trust II Trust Preferred Securities
2655,SCE$H,SCE Trust III Fixed/Floating Rate Trust Preference Securities
2656,SCG,SCANA Corporation Common Stock
2657,SCHW,Charles Schwab Corporation (The) Common Stock
2658,SCHW$B,Charles Schwab Corporation Depositary Shares Representing 1/40th Int Sh Non Cumulative Preferred Stock Series B
2659,SCI,Service Corporation International Common Stock
2660,SCL,Stepan Company Common Stock
2661,SCM,Stellus Capital Investment Corporation Common Stock
2662,SCQ,Stellus Capital Investment Corporation 6.50% Notes due 2019
2663,SCS,Steelcase Inc. Common Stock
2664,SCU,Scana Corporation SCANA CORPORATION 2009 Series A 7.70% Enhanced Junior Subordinated Notes
2665,SCX,L.S. Starrett Company (The) Common Stock
2666,SD,Sandridge Energy Inc. Common Stock
2667,SDLP,Seadrill Partners LLC Common Units Representing Limited Liability Company Interests
2668,SDR,SandRidge Mississippian Trust II Common Units representing Beneficial Interests
2669,SDRL,Seadrill Limited Ordinary Shares (Bermuda)
2670,SDT,SandRidge Mississippian Trust I Common Units of Beneficial Interest
2671,SE,Spectra Energy Corp Common Stock
2672,SEAS,"SeaWorld Entertainment, Inc. Common Stock"
2673,SEE,Sealed Air Corporation Common Stock
2674,SEM,Select Medical Holdings Corporation Common Stock
2675,SEMG,Semgroup Corporation Class A Common Stock
2676,SEP,"Spectra Energy Partners, LP Common Units representing Limited Partner Interests"
2677,SERV,"ServiceMaster Global Holdings, Inc. Common Stock"
2678,SF,Stifel Financial Corporation Common Stock
2679,SFB,Stifel Financial Corp. 6.70% Senior Note due 2022
2680,SFE,"Safeguard Scientifics, Inc. New Common Stock"
2681,SFG,"StanCorp Financial Group, Inc. Common Stock"
2682,SFL,Ship Finance International Limited
2683,SFN,Stifel Financial Corporation 5.375% Senior Notes due December 2022
2684,SFS,"Smart & Final Stores, Inc. Common Stock"
2685,SFUN,"SouFun Holdings Limited American Depositary Shares (Each representing Four Class A Ordinary Shares, HK$1.00 par value)"
2686,SFY,Swift Energy Company (Holding Company) Common Stock
2687,SGF,"Aberdeen Singapore Fund, Inc. Common Stock"
2688,SGL,"Strategic Global Income Fund, Inc. Common Stock"
2689,SGM,Stonegate Mortgage Corporation Common Stock
2690,SGU,"Star Gas Partners, L.P. Common Stock"
2691,SGY,Stone Energy Corporation Common Stock
2692,SGZA,"Selective Insurance Group, Inc. 5.875% Senior Notes due 2043"
2693,SHG,Shinhan Financial Group Co Ltd American Depositary Shares
