,Symbol,Name
0,A,"Agilent Technologies, Inc. Common Stock"
1,AA,Alcoa Inc. Common Stock
2,AA$B,Alcoa Inc. Depository Shares Representing 1/10th Preferred Convertilble Class B Series 1
3,AAC,"AAC Holdings, Inc. Common Stock"
4,AAN,"Aaron's, Inc. Common Stock"
5,AAP,Advance Auto Parts Inc Advance Auto Parts Inc W/I
6,AAT,"American Assets Trust, Inc. Common Stock"
7,AAV,Advantage Oil & Gas Ltd  Ordinary Shares
8,AB,Allianceberstein Holding L.P.  Units
9,ABB,ABB Ltd Common Stock
10,ABBV,AbbVie Inc. Common Stock
11,ABC,AmerisourceBergen Corporation (Holding Co) Common Stock
12,ABEV,Ambev S.A. American Depositary Shares (Each representing 1 Common Share)
13,ABG,Asbury Automotive Group Inc Common Stock
14,ABM,ABM Industries Incorporated Common Stock
15,ABR,Arbor Realty Trust Common Stock
16,ABR$A,Arbor Realty Trust Preferred Series A
17,ABR$B,Arbor Realty Trust Cumulative Redeemable Preferred Series B
18,ABR$C,Arbor Realty Trust Cumulative Redeemable Preferred Series C
19,ABRN,Arbor Realty Trust 7.375% Senior Notes due 2021
20,ABT,Abbott Laboratories Common Stock
21,ABX,Barrick Gold Corporation Common Stock
22,ACC,American Campus Communities Inc Common Stock
23,ACCO,Acco Brands Corporation Common Stock
24,ACE,Ace Limited Common Stock
25,ACG,Alliancebernstein Income Fund
26,ACH,Aluminum Corporation of China Limited American Depositary Shares
27,ACI,"Arch Coal, Inc. Common Stock"
28,ACM,AECOM Common Stock
29,ACMP,"Access Midstream Partners, L.P. Common Units Representing Limited Partner Interests"
30,ACN,Accenture plc. Class A Ordinary Shares (Ireland)
31,ACP,Avenue Income Credit Strategies Fund Common Shares
32,ACRE,Ares Commercial Real Estate Corporation Common Stock
33,ACT,Actavis plc Ordinary Shares
34,ACW,Accuride Corporation Common Stock
35,ADC,Agree Realty Corporation Common Stock
36,ADM,Archer
37,ADPT,Adeptus Health Inc. Common Stock
38,ADS,Alliance Data Systems Corporation Common Stock
39,ADT,ADT Corporation Common Stock
40,ADX,Adams Express Company (The)
41,AEB,AEGON N.V. Perp. Cap. Secs. Floating Rate (Netherlands)
42,AEC,Associated Estates Realty Corporation Common Stock
43,AED,AEGON N.V. Perp. Cap. Securities (Netherlands)
44,AEE,Ameren Corporation Common Stock
45,AEG,AEGON N.V. Common Stock
46,AEH,AEGON N.V. Perp. Cap Secs.
47,AEK,Aegon NV 8.00% Non
48,AEL,American Equity Investment Life Holding Company Common Stock
49,AEM,Agnico Eagle Mines Limited Common Stock
50,AEO,"American Eagle Outfitters, Inc. Common Stock"
51,AEP,"American Electric Power Company, Inc. Common Stock"
52,AER,Aercap Holdings N.V. Ordinary Shares
53,AES,The AES Corporation Common Stock
54,AES$C,AES Corporation (The) Class C Preferred Stock
55,AET,Aetna Inc. Common Stock
56,AF,Astoria Financial Corporation Common Stock
57,AF$C,Astoria Financial Corporation Depositary Shs Repstg 1/40th Int Perp Pfd Ser C 6.5%
58,AFA,"American Financial Group, Inc. 5.75% Senior Notes due 2042"
59,AFB,AllianceBernstein National Municipal Income Fund Inc
60,AFC,"Allied Capital Corporation Allied Capital Corporation 6.875% Notes due April 15, 2047"
61,AFG,"American Financial Group, Inc. Common Stock"
62,AFGE,"American Financial Group, Inc. 6.25% Subordinated Debentures due 2054"
63,AFL,AFLAC Incorporated Common Stock
64,AFM,"Affiliated Managers Group, Inc. 5.250% Senior Notes due 2022"
65,AFQ,"American Financial Group, Inc. 7% Senior Notes due 2050"
66,AFSD,"Aflac Incorporated 5.50% Subordinated Debentures due September 15, 2052"
67,AFSI$A,"AmTrust Financial Services, Inc. Preferred Series A"
68,AFSI$B,"AmTrust Financial Services, Inc. Depository Shares Representing 1/40th Preferred Series B"
69,AFSI$C,"AmTrust Financial Services, Inc. Depository Shares Representing 1/40th Preferred Series C"
70,AFT,Apollo Senior Floating Rate Fund Inc. Common Stock
71,AFW,"American Financial Group, Inc. 6 3/8% Senior Notes due 2042"
72,AG,First Majestic Silver Corp. Ordinary Shares (Canada)
73,AGC,Advent Claymore Convertible Securities and Income Fund Common Shares of Beneficial Interest
74,AGCO,AGCO Corporation Common Stock
75,AGD,Alpine Global Dynamic Dividend Fund Shares of Beneficial Interest
76,AGI,Alamos Gold Inc Ordinary Shares
77,AGM,Federal Agricultural Mortgage Corporation Common Stock
78,AGM$A,Federal Agricultural Mortgage Corporation 5.875% Non
79,AGM$B,Federal Agricultural Mortgage Corporation Non Cumulative Preferred Stock Series B
80,AGM$C,Federal Agricultural Mortgage Corporation Preferred Series C Fixed to Fltg
81,AGM.A,Federal Agricultural Mortgage Corporation Common Stock
82,AGN,"Allergan, Inc. Common Stock"
83,AGO,Assured Guaranty Ltd. Common Stock
84,AGO$B,Assured Guaranty Ltd.
85,AGO$E,Assured Guaranty Ltd.
86,AGO$F,Assured Guaranty Ltd.
87,AGRO,Adecoagro S.A. Common Shares
88,AGU,Agrium Inc. Common Stock
89,AGX,"Argan, Inc. Common Stock"
90,AHC,A.H. Belo Corporation Common Stock
91,AHH,"Armada Hoffler Properties, Inc. Common Stock"
92,AHL,Aspen Insurance Holdings Limited Ordinary Shares
93,AHL$A,Aspen Insurance Holdings Limited Perp Pfd Shares (Bermuda)
94,AHL$B,Aspen Insurance Holdings Limited Perp Pref Shs (Bermuda)
95,AHL$C,Aspen Insurance Holdings Limited 5.95% Fixed
96,AHP,"Ashford Hospitality Prime, Inc. Common Stock"
97,AHS,AMN Healthcare Services Inc AMN Healthcare Services Inc
98,AHT,Ashford Hospitality Trust Inc Common Stock
99,AHT$A,Ashford Hospitality Trust Inc 8.55% Cum Preferred Series A
100,AHT$D,Ashford Hospitality Trust Inc 8.45% Series D Cumulative Preferred Stock
101,AHT$E,Ashford Hospitality Trust Inc 9.00% Series E Cumulative Preferred Stock
102,AI,Arlington Asset Investment Corp Class A (new)
103,AIB,Apollo Investment Corporation 6.625% Senior Notes due 2042
104,AIF,Apollo Tactical Income Fund Inc. Common Stock
105,AIG,"American International Group, Inc. New Common Stock"
106,AIG.W,"American International Group, Inc. Warrant expiring January 19, 2021"
107,AIN,Albany International Corporation Common Stock
108,AIR,AAR Corp. Common Stock
109,AIT,"Applied Industrial Technologies, Inc. Common Stock"
110,AIV,Apartment Investment and Management Company Common Stock
111,AIV$A,Apartment Investment and Management Company Preferred Series Class A
112,AIV$Z,Apartment Investment and Management Company Class Z Cumulative Preferred Stock
113,AIW,Arlington Asset Investment Corp 6.625% Notes due 2023
114,AIY,Apollo Investment Corporation 6.875% Senior Notes due 2043
115,AIZ,"Assurant, Inc. Common Stock"
116,AJG,Arthur J. Gallagher & Co. Common Stock
117,AKO.A,Embotelladora Andina S.A. Common Stock
118,AKO.B,Embotelladora Andina S.A. Common Stock
119,AKP,Alliance California Municipal Income Fund Inc
120,AKR,Acadia Realty Trust Common Stock
121,AKS,AK Steel Holding Corporation Common Stock
122,AL,Air Lease Corporation Class A Common Stock
123,ALB,Albemarle Corporation Common Stock
124,ALDW,"Alon USA Partners, LP Common Units representing Limited Partner Interests"
125,ALE,"Allete, Inc."
126,ALEX,"Alexander & Baldwin, Inc. Common Stock"
127,ALG,"Alamo Group, Inc. Common Stock"
128,ALJ,"Alon USA Energy, Inc. common stick"
129,ALK,"Alaska Air Group, Inc. Common Stock"
130,ALL,Allstate Corporation (The) Common Stock
131,ALL$A,Allstate Corporation (The) Dep Shs Repstg 1/1000th Perp Pfd Ser A
132,ALL$B,Allstate Corporation (The) 5.100% Fixed
133,ALL$C,Allstate Corporation (The) Dep Shs Repstg 1/1000th Int Shs Pfd Stk Ser C
134,ALL$D,The Allstate Corporation Leopards Each Representing A 1/1000th Interest In A Share Of Fixed Rate Noncumulative Perpetual Preferred Stock Series D
135,ALL$E,Allstate Corporation Depositary Shares Representing 1/1000th Perpetual Preferred Series E
136,ALL$F,Allstate Corporation (The) Leopards Dep Shares Representing 1/1000th Perp Pfd
137,ALLE,Allegion plc Ordinary Shares
138,ALLY,Ally Financial Inc. Common Stock
139,ALLY$A,"GMAC Capital Trust I Fixed Rate Floating Rate Trust Preferred Securities, Series 2"
140,ALLY$B,"Ally Financial Inc Fixed Rate Floating Rate Perpetual Preferred Stock, Series A"
141,ALP$N,Alabama Power Company Preferred Stock
142,ALP$O,Alabama Power Company Preferred Stock
143,ALP$P,Alabama Power Company 5.30% Cl A Pfd Stk
144,ALR,Alere Inc. Common Stock
145,ALR$B,"Alere Inc. Inverness Medical Innovations, Inc. Series B Convertible Perpetual Preferred Stock"
146,ALSN,"Allison Transmission Holdings, Inc. Common Stock"
147,ALU,Alcatel
148,ALV,"Autoliv, Inc. Common Stock"
149,ALX,"Alexander's, Inc. Common Stock"
150,AM,Antero Midstream Partners LP Common Units representing limited partner interests
151,AMBR,"Amber Road, Inc. Common Stock"
152,AMC,"AMC Entertainment Holdings, Inc. Class A Common Stock"
153,AME,"AMETEK, Inc."
154,AMFW,AMEC Foster Wheeler plc American Depositary Shares
155,AMG,"Affiliated Managers Group, Inc. Common Stock"
156,AMH,American Homes 4 Rent Common Shares of Beneficial Interest
157,AMH$A,American Homes 4 Rent Participating Preferred Shares Series A
158,AMH$B,American Homes 4 Rent 5% Series B Participating Preferred Shares of Beneficial Interest
159,AMH$C,American Homes 4 Rent Participating Pfd Ser C
160,AMID,"American Midstream Partners, LP Common Units representing Limited Partner Interests"
161,AMP,"Ameriprise Financial, Inc. Common Stock"
162,AMRC,"Ameresco, Inc. Class A Common Stock"
163,AMRE,"AmREIT, Inc. Common stock"
164,AMT,American Tower Corporation (REIT) Common Stock
165,AMT$A,American Tower Corporation (REIT) Pfd Conv Ser A
166,AMTD,TD Ameritrade Holding Corporation Common Stock
167,AMTG,"Apollo Residential Mortgage, Inc. Common Stock"
168,AMTG$A,"Apollo Residential Mortgage, Inc. Pfd Shs Series A  (US)"
169,AMX,"America Movil, S.A.B. de C.V. American Depository Receipt Series L"
170,AN,"AutoNation, Inc. Common Stock"
171,ANET,"Arista Networks, Inc. Common Stock"
172,ANF,Abercrombie & Fitch Company Common Stock
173,ANFI,Amira Nature Foods Ltd Ordinary Shares
174,ANH,Anworth Mortgage Asset Corporation Common Stock
175,ANH$A,Anworth Mortgage Asset Corporation Series A Preferred Stock
176,ANH$B,Anworth Mortgage Asset  Corporation Preferred Stock Series B 6.25%
177,ANN,ANN INC. Common Stock
178,ANR,"Alpha Natural Resources, inc. comm stock"
179,ANTM,"Anthem, Inc. Common Stock"
180,ANW,Aegean Marine Petroleum Network Inc. Common Stock
181,AOD,Alpine Total Dynamic Dividend Fund Common Stock
182,AOI,"Alliance One International, Inc. Common Stock"
183,AOL,AOL Inc. AOL Inc. Common Stock
184,AON,Aon plc Class A Ordinary Shares (UK)
185,AOS,A.O. Smith Corporation Common Stock
186,AP,Ampco
187,APA,Apache Corporation Common Stock
188,APAM,Artisan Partners Asset Management Inc. Class A Common Stock
189,APB,"Asia Pacific Fund, Inc. (The)"
190,APC,Anadarko Petroleum Corporation Common Stock
191,APD,"Air Products and Chemicals, Inc. Common Stock"
192,APF,Morgan Stanley Asia
193,APH,Amphenol Corporation Common Stock
194,APL,"Atlas Pipeline Partners, L.P. Common Units, No Par Value"
195,APL$E,"Atlas Pipeline Partners, L.P. Cumulative Redeemable Perpetual Preferred Units Class E"
196,APO,"Apollo Global Management, LLC Class A Common Shares Representing Class A Limitied Liability Company Interests"
197,APU,"AmeriGas Partners, L.P. Common Stock"
198,AR,Antero Resources Corporation Common Stock
199,ARC,"ARC Document Solutions, Inc. Common Stock"
200,ARCO,Arcos Dorados Holdings Inc. Class A Shares
201,ARCX,Arc Logistic Partners LP Common Units representing limited partner interest
202,ARDC,"Ares Dynamic Credit Allocation Fund, Inc. Common Shares"
203,ARE,"Alexandria Real Estate Equities, Inc. Common Stock"
204,ARE$E,"Alexandria Real Estate Equities, Inc. Pfd Ser E"
205,ARES,Ares Management L.P. Common Units representing Limited Partner Interests
206,ARG,"Airgas, Inc. Common Stock"
207,ARH$C,Arch Capital Group Ltd. 6.75% PFD sh S C
208,ARI,"Apollo Commercial Real Estate Finance, Inc"
209,ARI$A,Apollo Commercial Real Estate Finance Cumulative Redeemable Perpetual Preferred Stock Series A
210,ARL,"American Realty Investors, Inc. Common Stock"
211,ARMF,Ares Multi
212,ARMK,Aramark Common Stock
213,ARN,Ares Capital Corporation 7.00% Senior Notes due 2022
214,ARO,Aeropostale Inc Common Stock
215,ARP,"Atlas Resource Partners, L.P. Common Units representing Limited Partner Interests"
216,ARP$D,"Atlas Resource Partners, L.P. CUM RED PERP PDF UNIT CL D %"
217,ARPI,"American Residential Properties, Inc. Common Stock"
218,ARR,"ARMOUR Residential REIT, Inc."
219,ARR$A,Armour Residential REIT INC Preferred Series A
220,ARR$B,"ARMOUR Residential REIT, Inc. Preferred Series B"
221,ARU,Ares Capital Corporation 5.875% Senior Notes due 2022
222,ARW,"Arrow Electronics, Inc. Common Stock"
223,ARY,Ares Capital Corporation 7.75% Senior Notes due 2040
224,ASA,ASA  Gold and Precious Metals Limited
225,ASB,Associated Banc
226,ASB$B,Associated Banc
227,ASC,Ardmore Shipping Corporation Common Stock
228,ASG,Liberty All
229,ASGN,"On Assignment, Inc. Common Stock"
230,ASH,Ashland Inc. (NEW) Common Stock
231,ASPN,"Aspen Aerogels, Inc. Common Stock"
232,ASR,"Grupo Aeroportuario del Sureste, S.A. de C.V. Common Stock"
233,ASX,"Advanced Semiconductor Engineering, Inc. Common Stock"
234,AT,Atlantic Power Corporation Ordinary Shares (Canada)
235,ATE,Advantest Corporation (Kabushiki Kaisha Advantest) ADS American Depositary Shares
236,ATEN,"A10 Networks, Inc. Common Stock"
237,ATHM,"Autohome Inc. American Depositary Shares, each representing one class A ordinary share."
238,ATI,Allegheny Technologies Incorporated Common Stock
239,ATK,Alliant Techsystems Inc. Common Stock
240,ATLS,"Atlas Energy, L.P. Common Units"
241,ATO,Atmos Energy Corporation Common Stock
242,ATR,"AptarGroup, Inc. Common Stock"
243,ATTO,Atento S.A. Ordinary Shares
244,ATU,Actuant Corporation Common Stock
245,ATV,"Acorn International, Inc. ADS"
246,ATW,"Atwood Oceanics, Inc. Common Stock"
247,AU,AngloGold Ashanti Limited Common Stock
248,AUO,AU Optronics Corp American Depositary Shares
249,AUQ,AuRico Gold Inc. Ordinary Shares
250,AUY,Yamana Gold Inc. Ordinary Shares (Canada)
251,AV,Aviva plc Unsponsored ADR (UK)
252,AVA,Avista Corporation Common Stock
253,AVAL,Grupo Aval Acciones y Valores S.A. ADR (Each representing 20 preferred shares)
254,AVB,"AvalonBay Communities, Inc. Common Stock"
255,AVD,American Vanguard Corporation Common Stock ($0.10 Par Value)
256,AVG,AVG Technologies N.V. Ordinary Shares
257,AVH,Avianca Holdings S.A. American Depositary Shares (Each representing 8 preferred Shares)
258,AVIV,"Aviv REIT, Inc. Common Stock"
259,AVK,Advent Claymore Convertible Securities and Income Fund
260,AVOL,Avolon Holdings Limited Common Shares
261,AVP,"Avon Products, Inc. Common Stock"
262,AVT,"Avnet, Inc. Common Stock"
263,AVV,Aviva plc Subordinated Capital Securities due 2041
264,AVX,AVX Corporation Common Stock
265,AVY,Avery Dennison Corporation Common Stock
266,AWF,Alliancebernstein Global High Income Fund
267,AWH,"Allied World Assurance Company Holdings, AG (Switzerland)"
268,AWI,Armstrong World Industries Inc Common Stock
269,AWK,"American Water Works Company, Inc. Common Stock"
270,AWP,Alpine Global Premier Properties Fund Alpine Global Premier Properties Fund Common Shares of Beneficial Interest
271,AWR,American States Water Company Common Stock
272,AXE,Anixter International Inc. Common Stock
273,AXL,"American Axle & Manufacturing Holdings, Inc. Common Stock"
274,AXLL,Axiall Corporation Common Stock
275,AXP,American Express Company Common Stock
276,AXR,AMREP Corporation Common Stock
277,AXS,Axis Capital Holdings Limited Common Stock
278,AXS$C,Axis Capital Holdings Limited Preferred Series C (Bermuda)
279,AXS$D,Axis Capital Holdings Limited Preferred Series D (Bermuda)
280,AXTA,Axalta Coating Systems Ltd. Common Shares
281,AYI,Acuity Brands Inc (Holding Company)
282,AYN,Alliance New York Municipal Income Fund Inc
283,AYR,Aircastle Limited Common Stock
284,AZN,Astrazeneca PLC Common Stock
285,AZO,"AutoZone, Inc. Common Stock"
286,AZZ,AZZ Incorporated Common Stock
287,B,"Barnes Group, Inc. Common Stock"
288,BA,Boeing Company (The) Common Stock
289,BABA,Alibaba Group Holding Limited American Depositary Shares each representing one Ordinary share
290,BAC,Bank of America Corporation Common Stock
291,BAC$D,Bank of America Corporation Depositary Shares Rpstg 1/1000th Interest in Sh of Non Cum Pfd Stk Ser D
292,BAC$E,Bank of America Corporation Depositary Sh repstg 1/1000th Perp Pfd Ser E
293,BAC$I,Bank Amer Corp Dep Sh Repstg 1/1000th Pfd Ser I
294,BAC$L,Bank of America Corporation Non Cumulative Perpetual Conv Pfd Ser L
295,BAC$W,Bank of America Corporation Depository Shares Representing 1/1000th Preferred Series W
296,BAC$Z,Bank of America Corporation BAC Capital Trust VIII 6% Capital Securities
297,BAC.A,"Bank of America Corporation Class A Warrant expiring January 16, 2019"
298,BAC.B,Bank of America Corporation Class B Warrants expiring 10/28/2018
299,BAF,BlackRock Municipal Income Investment Quality Trust
300,BAH,Booz Allen Hamilton Holding Corporation Common Stock
301,BAK,Braskem SA ADR
302,BALT,Baltic Trading Limited Common Stock
303,BAM,Brookfield Asset Management Inc. Common Stock
304,BANC,"Banc of California, Inc. Common Stock"
305,BANC$C,"Banc of California, Inc. Depositary Shares"
306,BAP,Credicorp Ltd. Common Stock
307,BAS,"Basic Energy Services, Inc. Common Stock"
308,BAX,Baxter International Inc. Common Stock
309,BBD,Banco Bradesco Sa American Depositary Shares
310,BBDO,Banco Bradesco Sa American Depositary Shares (each representing one Common Share)
311,BBF,BlackRock Municipal Income Investment Trust
312,BBG,Bill Barrett Corporation Common Stock
313,BBK,Blackrock Municipal Bond Trust
314,BBL,BHP Billiton plc Sponsored ADR
315,BBN,BlackRock Build America Bond Trust Common Shares of Beneficial Interest
316,BBT,BB&T Corporation Common Stock
317,BBT$D,BB&T Corporation Depositary Shares Representing 1/1000th Perpetual Preferred Series D
318,BBT$E,BB&T Corporation Depositary Shares Representing 1/1000th Perpetual Preferred Series E
319,BBT$F,BB&T Corporation Depositary Shares Representing 1/1000th Interest Series F Perpetual Preferred
320,BBT$G,BB&T Corporation Depositary Shares Representing 1/1000th Perpetual Preferred Series G
321,BBVA,Banco Bilbao Vizcaya Argentaria S.A. Common Stock
322,BBW,Build
323,BBX,BBX Capital Corporation Common Stock
324,BBY,"Best Buy Co., Inc. Common Stock"
325,BC,Brunswick Corporation Common Stock
326,BCA,Corpbanca Sponsored Reg S GDR representing Common (Chile)
327,BCC,"Boise Cascade, L.L.C. Common Stock"
328,BCE,"BCE, Inc. Common Stock"
329,BCEI,"Bonanza Creek Energy, Inc. Common Stock"
330,BCH,Banco De Chile Banco De Chile ADS
331,BCO,Brinks Company (The) Common Stock
332,BCR,"C.R. Bard, Inc. Common Stock"
333,BCRH,Blue Capital Reinsurance Holdings Ltd. Common Shares
334,BCS,Barclays PLC Common Stock
335,BCS$,Barclays Bank PLC ADR Ser 2 repstg Pref Shs Ser 2 (United Kingdom)
336,BCS$A,Barclays PLC ADS
337,BCS$C,Barclays PLC American Depositary Shares Series 4
338,BCS$D,Barclays PLC American Depositary Shares (Each representing Non
339,BCX,BlackRock Resources Common Shares of Beneficial Interest
340,BDC,Belden Inc Common Stock
341,BDJ,Blackrock Enhanced Equity Dividend Trust
342,BDN,Brandywine Realty Trust Common Stock
343,BDN$E,Brandywine Realty Tr Pfd Shs Ben Int Ser E
344,BDX,"Becton, Dickinson and Company Common Stock"
345,BEE,Strategic Hotels & Resorts  Inc Common Stock
346,BEL,Belmond Ltd. Class A Common Stock
347,BEN,"Franklin Resources, Inc. Common Stock"
348,BEP,Brookfield Renewable Energy Partners LP Partnership Units (Bermuda)
349,BERY,"Berry Plastics Group, Inc. Common Stock"
350,BF.A,Brown Forman Inc Class A Common Stock
351,BF.B,Brown Forman Inc Class B Common Stock
352,BFAM,Bright Horizons Family Solutions Inc. Common Stock
353,BFK,BlackRock Municipal Income Trust
354,BFO,Blackrock Florida Municipal 2020 Term Trust
355,BFR,BBVA Banco Frances S.A. Common Stock
356,BFS,"Saul Centers, Inc. Common Stock"
357,BFS$C,"Saul Centers, Inc. Depositary Shares, each representing 1/100th of a share of 6.875% Series C Cumulative Redeemable Preferred Stock, $0.01 par value"
358,BFZ,BlackRock California Municipal Income Trust
359,BG,Bunge Limited Bunge Limited
360,BGB,Blackstone / GSO Strategic Credit Fund Common Shares
361,BGC,General Cable Corporation Common Stock
362,BGCA,"BGC Partners, Inc. 8.125% Senior Notes due 2042"
363,BGE$B,Bge Cap Trust II 6.20% Trust Preferred Securities
364,BGG,Briggs & Stratton Corporation Common Stock
365,BGH,Babson Capital Global Short Duration High Yield Fund Common Shares of Beneficial Interests
366,BGR,BlackRock Energy and Resources Trust
367,BGS,"B&G Foods, Inc. B&G Foods, Inc. Common Stock"
368,BGT,BlackRock Floating Rate Income Trust
369,BGX,Blackstone GSO Long Short Credit Income Fund Common Shares
370,BGY,"BLACKROCK INTERNATIONAL, LTD. Blackrock International Real Estate Fund, Inc."
371,BH,Biglari Holdings Inc.
372,BHE,"Benchmark Electronics, Inc. Common Stock"
373,BHI,Baker Hughes Incorporated Common Stock
374,BHK,Blackrock Core Bond Trust Blackrock Core Bond Trust
375,BHL,Blackrock Defined Opportunity Credit Trust Blackrock Defined Opportunity Credit Trust
376,BHLB,"Berkshire Hills Bancorp, Inc. Common Stock"
377,BHP,BHP Billiton Limited Common Stock
378,BID,Sotheby's Common Stock
379,BIE,BlackRock Municipal Bond Investment Trust
380,BIF,"Boulder Growth & Income Fund, Inc."
381,BIG,"Big Lots, Inc. Common Stock"
382,BIN,Progressive Waste Solutions Ltd. Common Shares
383,BIO,Bio
384,BIO.B,Bio
385,BIOA,BioAmber Inc. Common Stock
386,BIOA.W,"BioAmber Inc. Warrant, expiring May 9, 2017"
387,BIP,Brookfield Infrastructure Partners LP Limited Partnership Units
388,BIT,BlackRock Multi
389,BITA,Bitauto Holdings Limited American Depositary Shares (each representing one ordinary share)
390,BJZ,Blackrock California Municipal 2018 Term Trust Blackrock California Municipal 2018 Term Trust
391,BK,Bank of New York Mellon Corporation (The) Common Stock
392,BK$C,Bank Of New York Mellon Corporation (The) Dep Shs Repstg 1/4000th Perp Pfd Ser C
393,BKD,Brookdale Senior Living Inc. Common Stock
394,BKE,"Buckle, Inc. (The) Common Stock"
395,BKH,Black Hills Corporation Common Stock
396,BKK,Blackrock Municipal 2020 Term Trust
397,BKN,BlackRock Investment Quality Municipal Trust Inc. (The)
398,BKS,"Barnes & Noble, Inc. Common Stock"
399,BKT,BlackRock Income Trust Inc. (The)
400,BKU,"BankUnited, Inc. Common Stock"
401,BLH,Blackrock New York Municipal 2018 Term Trust
402,BLK,"BlackRock, Inc. Common Stock"
403,BLL,Ball Corporation Common Stock
404,BLOX,Infoblox Inc. Common Stock
405,BLT,"Blount International, Inc. Common Stock"
406,BLW,Blackrock Limited Duration Income Trust
407,BLX,"Banco Latinoamericano de Comercio Exterior, S.A."
408,BMA,Banco Macro S.A.  ADR (representing Ten Class B Common Shares)
409,BME,Blackrock Health Sciences Trust
410,BMI,"Badger Meter, Inc. Common Stock"
411,BML$G,Bank of America Corporation Bank of America Corporation Depositary Shares (Each representing a 1/1200th interest in a share of Floating Rate Non
412,BML$H,Bank of America Corporation Bank of America Corporation Depositary Shares (Each representing a 1/1200th interest in a Share of Floating Rate Non
413,BML$I,Bank of America Corporation Bank of America Corporation Depositary Shares (Each representing a 1/1200th interest in a Share of 6.375% Non
414,BML$J,Bank of America Corporation Bank of America Corporation Depositary Shares (Each representing a 1/1200th interest in a Share of Floating Rate Non
415,BML$L,Bank of America Corporation Bank of America Corporation Depositary Shares (Each representing a 1/1200th Interest in a Share of Floating Rate Non
416,BMO,Bank Of Montreal Common Stock
417,BMR,Biomed Realty Trust Common Stock
418,BMS,"Bemis Company, Inc. Common Stock"
419,BMY,Bristol
420,BNJ,BlackRock New Jersey Municipal Income Trust
421,BNK,"C1 Financial, Inc. Common Stock"
422,BNS,Bank Nova Scotia Halifax Pfd 3 Ordinary Shares
423,BNY,BlackRock New York Municipal Income Trust
424,BOCA,"Banc of California, Inc. Senior Note due 4/15/2020"
425,BOE,Blackrock Global Blackrock Global Opportunities Equity Trust Common Shares of Beneficial Interest
426,BOH,Bank of Hawaii Corporation Common Stock
427,BOI,Brookfield Mortgage Opportunity Income Fund Inc. Common Stock
428,BOOT,"Boot Barn Holdings, Inc. Common Stock"
429,BORN,China New Borun Corporation American Depositary Shares
430,BOXC,Brookfield Canada Office Properties
431,BP,BP p.l.c. Common Stock
432,BPI,"Bridgepoint Education, Inc."
433,BPK,Blackrock Municipal 2018 Term Trust Blackrock Municipal 2018 Term Trust
434,BPL,Buckeye Partners L.P. Common Stock
435,BPT,BP Prudhoe Bay Royalty Trust Common Stock
436,BPY,Brookfield Property Partners L.P. Limited Partnership Units
437,BPZ,"BPZ Resources, Inc Common Stock"
438,BQH,Blackrock New York Municipal Bond Trust Common Shares of Beneficial Interest
439,BR,"Broadridge Financial Solutions, Inc.Common Stock"
440,BRC,Brady Corporation Common Stock
441,BRFS,BRF S.A.
442,BRK.A,Berkshire Hathaway Inc. Common Stock
443,BRK.B,Berkshire Hathaway Inc. New Common Stock
444,BRO,"Brown & Brown, Inc. Common Stock"
445,BRP,Brookfield Residential Properties Inc. Common Stock
446,BRS,Bristow Group Inc. Common Stock
447,BRSS,"Global Brass and Copper Holdings, Inc. Common Stock"
448,BRT,BRT Realty Trust Common Stock
449,BRX,Brixmor Property Group Inc. Common Stock
450,BSAC,Banco Santander
451,BSBR,"Banco Santander Brasil SA American Depositary Shares, each representing one unit"
452,BSD,BlackRock Strategic Municipal Trust Inc. (The) Common Stock
453,BSE,Blackrock New York Municipal Income Quality Trust Common Shares of Beneficial Interest
454,BSI,Alon Blue Square Israel Ltd.
455,BSL,Blackstone GSO Senior Floating Rate Term Fund Common Shares of Beneficial Interest
456,BSMX,"Grupo Financiero Santander Mexico S.A. B. de C.V. American Depositary Shares, each representing five Series B shares"
457,BST,BlackRock Science and Technology Trust Common Shares of Beneficial Interest
458,BSX,Boston Scientific Corporation Common Stock
459,BT,BT Group plc Common Stock
460,BTA,BlackRock Long
461,BTE,Baytex Energy Corp
